{
  "$schema": "https://json-schema.org/draft/2020-12/schema",
  "$schemaVersion": "0.0.1",
  "$id": "https://raw.githubusercontent.com/smart-data-models/Candidates/master/standards/gaiax-ontology-v2111/models/LinkConnectivityServiceOffering/schema.json",
  "modelTags": "GaiaX,Ontology,Network,ServiceOffering",
  "title": "Smart Data Models - Gaia-X Ontology - LinkConnectivityServiceOffering",
  "description": "https://w3id.org/gaia-x/2.1.11#class/LinkConnectivityServiceOffering. Link-level connectivity service offering (no formal definition provided by the source ontology beyond its class hierarchy position). Subclass of ConnectivityServiceOffering per the Gaia-X ontology; inherited properties are documented on the ConnectivityServiceOffering model and not repeated here.",
  "type": "object",
  "properties": {
    "id": {
      "type": "string",
      "format": "uri",
      "description": "Property. Unique identifier of the entity"
    },
    "type": {
      "type": "string",
      "enum": [
        "LinkConnectivityServiceOffering"
      ],
      "description": "Property. NGSI-LD Entity type. It must be equal to 'LinkConnectivityServiceOffering'"
    },
    "dateCreated": {
      "type": "string",
      "format": "date-time",
      "description": "Property. Model:'https://schema.org/DateTime'. Entity creation timestamp."
    },
    "dateModified": {
      "type": "string",
      "format": "date-time",
      "description": "Property. Model:'https://schema.org/DateTime'. Timestamp of the last modification."
    },
    "source": {
      "type": "string",
      "description": "Property. A sequence of characters giving the source of the entity data."
    },
    "dataProvider": {
      "type": "string",
      "description": "Property. A sequence of characters identifying the provider of the harmonised data entity."
    },
    "protocolType": {
      "type": "string",
      "description": "Property. Link protocol type. Controlled-vocabulary value (ProtocolType), enumeration not resolved in this pass."
    },
    "vlanConfiguration": {
      "type": "string",
      "format": "uri",
      "description": "Relationship. VLAN configuration. Links to a VLANConfiguration entity."
    }
  },
  "required": [
    "id",
    "type",
    "protocolType"
  ]
}
