{
  "id": "urn:ngsi-ld:LinkConnectivityServiceOffering:001",
  "type": "LinkConnectivityServiceOffering",
  "dateCreated": "2026-08-20T10:00:00Z",
  "dateModified": "2026-08-20T10:00:00Z",
  "source": "https://docs.gaia-x.eu/ontology/v2111/classes/LinkConnectivityServiceOffering/",
  "dataProvider": "Gaia-X AISBL",
  "protocolType": "Ethernet",
  "vlanConfiguration": "urn:ngsi-ld:VLANConfiguration:001"
}
